{
  "esquema": "1.0",
  "id": "desocupacion.gba",
  "serie": "desocupacion",
  "codigo": "TRA-01",
  "nombre": "Tasa de desocupación",
  "variante": "gba",
  "nombre_variante": "Gran Buenos Aires, sin empalmar",
  "es_variante_por_defecto": false,
  "unidad": "% de la población económicamente activa",
  "tipo": "tasa",
  "agregacion": "promedio",
  "frecuencia": "semestral (1974–2003) y trimestral (2003–hoy)",
  "metodo": "Igual que la variante del total urbano, pero para el Gran Buenos Aires, que tiene la misma cobertura geográfica en todo el período. La fuente publica fracciones; se multiplican por 100.",
  "tramos": [
    {
      "fuente": "f.indec.eph-puntual-gba",
      "desde": "1974-05",
      "hasta": "2003-05"
    },
    {
      "fuente": "f.indec.eph-continua-gba",
      "desde": "2003-07",
      "hasta": "hoy"
    }
  ],
  "cobertura": {
    "desde": "1974-05",
    "hasta": "2026-04"
  },
  "advertencias": [
    {
      "id": "q.desocupacion.eph-2003",
      "desde": "2003-05",
      "hasta": "2003-07",
      "tipo": "metodologia",
      "descripcion": "Cambio de encuesta: la EPH puntual (dos ondas por año, en mayo y octubre; la fuente las fecha en mayo y noviembre) se reemplazó por la EPH continua (resultados trimestrales) desde el tercer trimestre de 2003. Las tasas no son directamente comparables y en estas variantes no se aplican coeficientes de empalme."
    },
    {
      "id": "q.desocupacion.planes-2002",
      "desde": "2002-05",
      "hasta": null,
      "tipo": "metodologia",
      "descripcion": "Desde 2002, las personas que reciben planes de empleo con contraprestación laboral (como el Plan Jefes y Jefas de Hogar) se cuentan como ocupadas. Si se las contara como desocupadas, la tasa sería más alta."
    },
    {
      "id": "q.desocupacion.emergencia-2016",
      "desde": "2015-10",
      "hasta": "2016-01",
      "tipo": "intervencion",
      "descripcion": "Emergencia estadística: el INDEC no publicó la EPH del cuarto trimestre de 2015 ni la del primero de 2016."
    }
  ],
  "fuentes": [
    {
      "id": "f.indec.eph-puntual-gba",
      "organismo": "INDEC (publicado por la Subsecretaría de Programación Macroeconómica)",
      "nombre": "EPH puntual. Tasa de desocupación, Gran Buenos Aires, 1974–2003",
      "url": "https://datos.gob.ar/dataset/sspm-tasa-desocupacion-por-aglomerado-1974-2003",
      "licencia": "CC-BY-4.0",
      "id_api": "343.1_GRAN_BUENORES__17"
    },
    {
      "id": "f.indec.eph-continua-gba",
      "organismo": "INDEC (publicado por la Subsecretaría de Programación Macroeconómica)",
      "nombre": "EPH continua. Tasa de desocupación, Gran Buenos Aires, trimestral",
      "url": "https://apis.datos.gob.ar/series/api/series/?ids=42.3_EPH_PUNTUAGBA_0_M_28",
      "licencia": "CC-BY-4.0",
      "id_api": "42.3_EPH_PUNTUAGBA_0_M_28"
    }
  ],
  "licencia": "CC-BY-4.0",
  "cita": "Vaivén (2026). Tasa de desocupación, variante «gba». Versión de datos 2026-10-24. https://vaiven.argentino.workers.dev/series/desocupacion/",
  "version_datos": "2026-10-24T05:15:50Z",
  "desactualizada_desde": null,
  "datos": [
    ["1974-05", 4.2],
    ["1974-11", 2.5],
    ["1975-05", 2.4],
    ["1975-11", 2.8],
    ["1976-05", 4.8],
    ["1976-11", 4.1],
    ["1977-05", 3.4],
    ["1977-11", 2.2],
    ["1978-05", 3.9],
    ["1978-11", 1.7],
    ["1979-05", 2.0],
    ["1979-11", 2.0],
    ["1980-05", 2.3],
    ["1980-11", 2.3],
    ["1981-05", 4.1],
    ["1981-11", 5.0],
    ["1982-05", 5.7],
    ["1982-11", 3.7],
    ["1983-05", 5.2],
    ["1983-11", 3.1],
    ["1984-05", 4.1],
    ["1984-11", 3.6],
    ["1985-05", 5.5],
    ["1985-11", 4.9],
    ["1986-05", 4.8],
    ["1986-11", 4.5],
    ["1987-05", 5.4],
    ["1987-11", 5.2],
    ["1988-05", 6.3],
    ["1988-11", 5.7],
    ["1989-05", 7.6],
    ["1989-11", 7.0],
    ["1990-05", 8.6],
    ["1990-11", 6.0],
    ["1991-05", 6.3],
    ["1991-11", 5.3],
    ["1992-05", 6.6],
    ["1992-11", 6.7],
    ["1993-05", 10.6],
    ["1993-11", 9.6],
    ["1994-05", 11.1],
    ["1994-11", 13.1],
    ["1995-05", 20.2],
    ["1995-11", 17.4],
    ["1996-05", 18.0],
    ["1996-11", 18.8],
    ["1997-05", 17.0],
    ["1997-11", 14.3],
    ["1998-05", 14.0],
    ["1998-11", 13.3],
    ["1999-05", 15.6],
    ["1999-11", 14.4],
    ["2000-05", 16.0],
    ["2000-11", 14.7],
    ["2001-05", 17.2],
    ["2001-11", 19.0],
    ["2002-05", 22.0],
    ["2002-11", 18.8],
    ["2003-05", 16.4],
    ["2003-07", 17.44825379],
    ["2003-10", 15.5427529],
    ["2004-01", 14.55137378],
    ["2004-04", 15.77999734],
    ["2004-07", 14.0789761],
    ["2004-10", 13.02990786],
    ["2005-01", 14.40389658],
    ["2005-04", 13.3073425],
    ["2005-07", 12.19184639],
    ["2005-10", 10.99055893],
    ["2006-01", 12.32542563],
    ["2006-04", 11.19100898],
    ["2006-07", 11.16658244],
    ["2006-10", 9.715096051],
    ["2007-01", 10.92191426],
    ["2007-04", 8.703596613],
    ["2007-10", 7.792854948],
    ["2008-01", 8.952112623],
    ["2008-04", 8.397523025],
    ["2008-07", 8.431290083],
    ["2008-10", 7.651337906],
    ["2009-01", 8.528295737],
    ["2009-04", 8.824090373],
    ["2009-07", 9.834025871],
    ["2009-10", 9.074582918],
    ["2010-01", 8.4],
    ["2010-04", 8.1],
    ["2010-07", 8.2],
    ["2010-10", 8.0],
    ["2011-01", 7.9],
    ["2011-04", 7.9],
    ["2011-07", 7.8],
    ["2011-10", 7.7],
    ["2012-01", 7.5],
    ["2012-04", 7.7],
    ["2012-07", 8.4],
    ["2012-10", 7.7],
    ["2013-01", 8.9],
    ["2013-04", 7.6],
    ["2013-07", 7.4],
    ["2013-10", 6.5],
    ["2014-01", 7.7],
    ["2014-04", 7.9],
    ["2014-07", 7.9],
    ["2014-10", 7.2],
    ["2015-01", 7.9],
    ["2015-04", 7.2],
    ["2015-07", 6.0],
    ["2016-04", 10.6],
    ["2016-07", 10.0],
    ["2016-10", 8.5],
    ["2017-01", 10.9],
    ["2017-04", 10.0],
    ["2017-07", 9.6],
    ["2017-10", 8.4],
    ["2018-01", 10.7],
    ["2018-04", 11.4],
    ["2018-07", 10.5],
    ["2018-10", 10.5],
    ["2019-01", 11.1],
    ["2019-04", 11.9],
    ["2019-07", 11.1],
    ["2019-10", 10.0],
    ["2020-01", 11.5],
    ["2020-04", 13.2],
    ["2020-07", 13.8],
    ["2020-10", 12.55794408],
    ["2021-01", 11.0],
    ["2021-04", 10.19378414],
    ["2021-07", 8.9],
    ["2021-10", 7.4],
    ["2022-01", 7.3],
    ["2022-04", 7.8],
    ["2022-07", 8.2],
    ["2022-10", 6.957871898],
    ["2023-01", 7.661384459],
    ["2023-04", 6.7],
    ["2023-07", 6.168753392],
    ["2023-10", 6.5],
    ["2024-01", 9.0],
    ["2024-04", 8.31174084],
    ["2024-07", 7.6],
    ["2024-10", 7.1],
    ["2025-01", 9.1],
    ["2025-04", 8.657721737],
    ["2025-07", 6.8],
    ["2025-10", 8.6],
    ["2026-01", 8.7],
    ["2026-04", 8.2]
  ]
}
